{
    "$id": "https://w3id.org/traceability/schemas/NaturalGasProduct.json",
    "$schema": "https://json-schema.org/draft-07/schema#",
    "$comment": "{\"term\": \"NaturalGasProduct\", \"@id\": \"https://w3id.org/traceability#NaturalGasProduct\"}",
    "title": "Natural Gas Product",
    "description": "Tombstone information regarding a natural gas product",
    "type": "object",
    "properties": {
        "@context": {
            "type": "array"
        },
        "id": {
            "type": "string"
        },
        "issuanceDate": {
            "type": "string"
        },
        "credentialSubject": {
            "type": "object"
        },
        "issuer": {
            "oneOf": [
                {
                    "type": "string"
                },
                {
                    "type": "object"
                }
            ]
        },
        "type": {
            "oneOf": [
                {
                    "type": "string"
                },
                {
                    "type": "array"
                }
            ]
        },
        "product": {
            "$comment": "{\"term\": \"product\", \"@id\": \"https://www.gs1.org/voc/Product\"}",
            "title": "Product",
            "description": "Product details as outlined in the Product.json schema",
            "$ref": "https://w3id.org/traceability/schemas/Product.json"
        },
        "facility": {
            "$comment": "{\"term\": \"facility\", \"@id\": \"https://www.gs1.org/voc/Place\"}",
            "title": "Manufacture Facility",
            "description": "Information on the manufacture facility.",
            "$ref": "https://w3id.org/traceability/schemas/Place.json"
        },
        "UWI": {
            "$comment": "{\"term\": \"UWI\", \"@id\": \"https://schema.org/identifier?1\"}",
            "title": "Unique Well Identifier",
            "description": "Unique Well Identifier used for individual well identification.",
            "type": "string"
        },
        "HSCode": {
            "$comment": "{\"term\": \"HSCode\", \"@id\": \"https://w3id.org/identifier?2\"}",
            "title": "HSCode",
            "description": "Defines the Harmonized System Code for the Commodity",
            "type": "string"
        },
        "productionDate": {
            "$comment": "{\"term\": \"productionDate\", \"@id\": \"https://schema.org/DateTime#v2\"}",
            "title": "Production Date",
            "description": "Date when the product was created",
            "type": "string"
        },
        "observation": {
            "$comment": "{\"term\": \"observation\", \"@id\": \"https://w3id.org/traceability#observation\"}",
            "title": "Observation List",
            "description": "List of observations as seen and specified in the Inspection Report schema https://w3id.org/traceability?#InspectionReport",
            "type": "array",
            "items": {
                "$ref": "https://w3id.org/traceability/schemas/Observation.json"
            }
        }
    },
    "additionalProperties": false,
    "examples": []
}