{
  "@context": [
    "https://www.w3.org/2018/credentials/v1",
    "https://w3id.org/traceability/v1"
  ],
  "id": "http://example.org/credentials/",
  "type": [
    "VerifiableCredential"
  ],
  "issuanceDate": "2021-02-04T20:29:37+00:00",
  "issuer": "did:key:z6MktHQo3fRRohk44dsbE76CuiTpBmyMWq2VVjvV6aBSeE3U",
  "credentialSubject": {
    "@context": [
      "https://w3id.org/traceability/v1"
    ],
    "type": "LinkRole",
    "target": "https://example.com/related/link/123",
    "linkRelationship": "alternate"
  }
}