{
  "@context": [
    "https://www.w3.org/2018/credentials/v1",
    "https://w3id.org/traceability/v1"
  ],
  "id": "http://example.org/credentials/",
  "type": [
    "VerifiableCredential"
  ],
  "issuanceDate": "2021-02-04T20:29:37+00:00",
  "issuer": "did:example:123",
  "credentialSubject": {
    "@context": [
      "https://www.w3.org/2018/credentials/v1",
      "https://w3id.org/traceability/v1"
    ],
    "id": "https://example.com/credential/123",
    "type": [
      "VerifiableCredential",
      "CommercialInvoiceCertificate"
    ],
    "name": "Commercial Invoice Certificate",
    "description": "This document includes recommended commercial invoice fields.",
    "relatedLink": [
      {
        "type": [
          "LinkRole"
        ],
        "target": "https://www.example.com/template/123",
        "linkRelationship": "templateLink"
      },
      {
        "type": [
          "LinkRole"
        ],
        "target": "did:example:789",
        "linkRelationship": "billOfLadingLink"
      },
      {
        "type": [
          "LinkRole"
        ],
        "target": "https://www.example.com/credentials/123",
        "linkRelationship": "millTestReportLink"
      }
    ],
    "issuanceDate": "2019-12-11T03:50:55Z",
    "issuer": {
      "id": "did:example:123",
      "type": "Organization",
      "name": "Conroy Inc",
      "description": "Reverse-engineered user-facing process improvement",
      "address": {
        "type": "PostalAddress",
        "streetAddress": "832 Lehner Row",
        "addressLocality": "Schimmeltown",
        "addressRegion": "Wyoming",
        "postalCode": "26980-2000",
        "addressCountry": "Rwanda"
      },
      "email": "Maeve_Schowalter84@example.net",
      "phoneNumber": "555-407-8507",
      "faxNumber": "555-669-7664"
    },
    "credentialSubject": {
      "type": [
        "CommercialInvoice"
      ],
      "portOfEntry": {
        "type": [
          "PostalAddress"
        ],
        "addressLocality": "Seatle",
        "addressRegion": "Washington",
        "addressCountry": "USA"
      },
      "destinationCountry": "MEX",
      "purchaseDate": "2021-02-21",
      "customer": {
        "type": [
          "Organization"
        ],
        "address": {
          "type": [
            "PostalAddress"
          ],
          "organizationName": "Generic Motors of America",
          "streetAddress": "12 Generic Motors Dr",
          "addressLocality": "Detroit",
          "addressRegion": "Michigain",
          "postalCode": "48232-5170",
          "addressCountry": "USA"
        }
      },
      "provider": {
        "type": [
          "Organization"
        ],
        "address": {
          "type": [
            "PostalAddress"
          ],
          "organizationName": "Aishi Metal Shinzo Co., Ltd.",
          "streetAddress": "1651, Shimonakano, Yoshida",
          "addressLocality": "Tsubame-shi",
          "addressRegion": "Niigata-ken",
          "postalCode": "959-0215",
          "addressCountry": "Japan"
        }
      },
      "totalPaymentDue": {
        "type": [
          "PriceSpecification"
        ],
        "price": 150000,
        "priceCurrency": "USD"
      },
      "merchandise": [
        {
          "type": [
            "Product"
          ],
          "manufacturer": {
            "type": [
              "Organization"
            ]
          },
          "description": "UNS S30400 chromium-nickel stainless steel rolls.",
          "weight": {
            "type": [
              "QuantitativeValue"
            ],
            "unitCode": "lbs",
            "value": "10000"
          },
          "quantity": "5",
          "priceSpecification": {
            "type": [
              "PriceSpecification"
            ],
            "price": 10000,
            "priceCurrency": "USD"
          }
        },
        {
          "type": [
            "Product"
          ],
          "manufacturer": {
            "type": [
              "Organization"
            ]
          },
          "description": "Galvalannealed ASTM A-653 zinc-iron alloy-coated steel sheets.",
          "weight": {
            "type": [
              "QuantitativeValue"
            ],
            "unitCode": "lbs",
            "value": "20000"
          },
          "quantity": "10",
          "priceSpecification": {
            "type": [
              "PriceSpecification"
            ],
            "price": 10000,
            "priceCurrency": "USD"
          }
        }
      ]
    }
  }
}