{
  "@context": [
    "https://www.w3.org/2018/credentials/v1",
    "https://w3id.org/traceability/v1"
  ],
  "id": "http://example.org/credentials/",
  "type": [
    "VerifiableCredential"
  ],
  "issuanceDate": "2021-02-04T20:29:37+00:00",
  "issuer": "did:example:123",
  "credentialSubject": {
    "@context": [
      "https://w3id.org/traceability/v1"
    ],
    "type": "EcommerceWayBillCommodityContent",
    "wayBillGrouping": [
      {
        "type": "EcommerceWayBillCommodityGroup",
        "commodityItemNumber": "ivec7oe02okb",
        "natureQuantityOfGoods": "A lot of laptops that way a lot",
        "totalsCommodityGroup": {
          "type": "EcommerceWayBillTotals",
          "totalPieces": 855,
          "weight": 65183,
          "chargeableWeight": 58664.700000000004,
          "weightUnit": "lb",
          "rateCharge": 0.10401485049782919,
          "totalRateCharge": {
            "type": "PriceSpecification",
            "price": 6102,
            "priceCurrency": "PKR"
          }
        }
      }
    ],
    "totalsCommodityContent": {
      "type": "EcommerceWayBillTotals",
      "totalPieces": 96,
      "weight": 392939,
      "chargeableWeight": 353645.10000000003,
      "weightUnit": "kg",
      "rateCharge": 0.002304570316399124,
      "totalRateCharge": {
        "type": "PriceSpecification",
        "price": 815,
        "priceCurrency": "CNY"
      }
    }
  }
}