{
  "@context": [
    "https://www.w3.org/2018/credentials/v1",
    "https://w3id.org/traceability/v1"
  ],
  "id": "http://example.org/credentials/",
  "type": [
    "VerifiableCredential"
  ],
  "issuanceDate": "2021-02-04T20:29:37+00:00",
  "issuer": "did:key:z6MktHQo3fRRohk44dsbE76CuiTpBmyMWq2VVjvV6aBSeE3U",
  "credentialSubject": {
    "@context": [
      "https://w3id.org/traceability/v1"
    ],
    "type": "EcommercePackageRegistrationCredential",
    "trackingID": "978429431398",
    "packageItems": [
      {
        "type": "EcommercePackageItem",
        "productReceiptID": "https://vc.example.com/?queryID=0xCCEF62556D6E09E1409c08C0AcE0BB6650fc88cF0b16bfc5AD28bc41299C3B44",
        "packingListID": "https://vc.example.com/?queryID=0x645B1E124917dD61647Ae1DaA9A7a8fbc34c4B6AE3c3A577882e31C0c87fB45e",
        "orderID": "https://vc.example.com/?queryID=AB06f1f744a781480c521902a1a1dbf5f1d01e7ea21daf483e7668817e58597a",
        "productInOrder": [
          "https://vc.example.com/?queryID=7306f1f744a781480c521902a1a1dbf5f1d01e7ea21daf483e7668817e58599e"
        ]
      }
    ],
    "certificateName": "ACME Carrier Ecommerce Package Registration Certificate"
  }
}