{
  "@context": [
    "https://www.w3.org/2018/credentials/v1",
    "https://w3id.org/traceability/v1"
  ],
  "id": "https://example.com/credentials/123",
  "type": ["VerifiableCredential"],
  "issuanceDate": "2021-02-04T20:29:37+00:00",
  "issuer": "did:example:123",
   "credentialSubject": {
      "id": "did:example:123",
      "type": "Phytosanitary",
      "facility": {
         "type": "Place",
         "globalLocationNumber": "3857367970333",
         "geo": {
            "type": "GeoCoordinates",
            "latitude": "-86.0919",
            "longitude": "-135.9487"
         },
         "address": {
            "type": "PostalAddress",
            "organizationName": "Balistreri - Heathcote",
            "streetAddress": "745 Luigi Station",
            "addressLocality": "North Gregoryland",
            "addressRegion": "Illinois",
            "postalCode": "20685",
            "addressCountry": "USA"
         }
      },
      "inspector": {
         "type": "Inspector",
         "person": {
            "type": "Person",
            "firstName": "Alysha",
            "lastName": "Denesik",
            "email": "Earlene.Grant81@example.net",
            "phoneNumber": "555-184-8046",
            "worksFor": {
               "type": "Organization",
               "name": "Block, Schinner and Lemke",
               "description": "Specializing in Agriculture Inspections",
               "address": {
                  "type": "PostalAddress",
                  "streetAddress": "214 Schmeler Common",
                  "addressLocality": "East Brownhaven",
                  "addressRegion": "Florida",
                  "postalCode": "25831",
                  "addressCountry": "USA"
               },
               "email": "Elza.Schoen21@example.net",
               "phoneNumber": "555-113-7997"
            },
            "jobTitle": "Internal Inspection Facilitator"
         },
         "qualification": [
            {
               "type": "Qualification",
               "qualificationCategory": "Phytosanitary Inspector",
               "qualificationValue": "Director"
            }
         ]
      },
      "shipment": {
         "type": "ParcelDelivery",
         "deliveryAddress": {
            "type": "PostalAddress",
            "organizationName": "Target",
            "streetAddress": "8972 D'Amore Ways",
            "addressLocality": "East Brandy",
            "addressRegion": "Kentucky",
            "postalCode": "11185-7827",
            "addressCountry": "USA"
         },
         "originAddress": {
            "type": "PostalAddress",
            "organizationName": "Poppy's Produce",
            "streetAddress": "81859 Kira Isle",
            "addressLocality": "Teaganfort",
            "addressRegion": "Maryland",
            "postalCode": "07902",
            "addressCountry": "USA"
         },
         "deliveryMethod": "Truck transport",
         "trackingNumber": "41570762785"
      },
      "applicant": {
         "type": "Person",
         "firstName": "Orval",
         "lastName": "Kertzmann",
         "email": "Flavie_Dickinson89@example.com",
         "phoneNumber": "555-124-1797",
         "worksFor": {
            "type": "Organization",
            "name": "Vandervort - Williamson",
            "description": "Expanded encompassing frame",
            "address": {
               "type": "PostalAddress",
               "organizationName": "Poppy's Produce",
               "streetAddress": "81859 Kira Isle",
               "addressLocality": "Teaganfort",
               "addressRegion": "Maryland",
               "postalCode": "07902",
               "addressCountry": "USA"
            },
            "email": "Willa18@example.org",
            "phoneNumber": "555-915-2859"
         },
         "jobTitle": "Export Manager"
      },
      "inspectionDate": "2020-03-15",
      "inspectionType": "Food Safety",
      "observation": [
         {
            "type": "Observation",
            "property": {
               "type": "MechanicalProperty",
               "identifier": "ISO 1352",
               "name": "Torque-controlled fatigue testing",
               "description": "ISO 1352:2011 specifies the conditions for performing torsional, constant-amplitude, nominally elastic stress fatigue tests on metallic specimens without deliberately introducing stress concentrations. The tests are carried out at ambient temperature (ideally at between 10 °C and 35 °C) in air by applying a pure couple to the specimen about its longitudinal axis."
            },
            "measurement": {
               "type": "MeasuredValue",
               "value": "00.00",
               "unitCode": "UNKNOWN"
            }
         }
      ],
      "certificateNumber": "3403816816",
      "plantOrg": {
         "type": "Organization",
         "name": "Lind LLC",
         "description": "Plant Services",
         "address": {
            "type": "PostalAddress",
            "streetAddress": "075 Jennings Haven",
            "addressLocality": "Millsfort",
            "addressRegion": "Connecticut",
            "postalCode": "58116",
            "addressCountry": "USA"
         },
         "email": "Fay9@example.org",
         "phoneNumber": "555-605-4698"
      },
      "distinguishingMarks": "Some fading and slight packaging damage on the bottom of the package.",
      "portOfEntry": {
         "type": "Place",
         "address": {
            "type": "PostalAddress",
            "addressLocality": "Treutelmouth",
            "addressRegion": "South Carolina"
         }
      },
      "additionalDeclaration": "Voluptas quia sed voluptatem quaerat.",
      "disinfectionDate": "2021-02-22",
      "disinfectionTreatment": "Fumigant - Phosphine",
      "disinfectionChemical": "Methyl Bromide",
      "disinfectionDuration": "144 minutes",
      "disinfectionTemperature": {
         "type": "MeasuredValue",
         "value": "20",
         "unitCode": "Celsius"
      },
      "disinfectionConcentration": {
         "type": "MeasuredValue",
         "value": "10",
         "unitCode": "Percent"
      },
      "signatureDate": "2021-03-12"
   }
}
