{
  "@context": [
    "https://www.w3.org/2018/credentials/v1",
    "https://w3id.org/traceability/v1"
  ],
  "id": "http://example.org/credentials/",
  "type": [
    "VerifiableCredential"
  ],
  "issuanceDate": "2021-02-04T20:29:37+00:00",
  "issuer": "did:key:z6MktHQo3fRRohk44dsbE76CuiTpBmyMWq2VVjvV6aBSeE3U",
  "credentialSubject": {
    "@context": [
      "https://w3id.org/traceability/v1"
    ],
    "type": "EcommerceOrderRegistrationCredential",
    "orderID": "Order#455",
    "productInOrder": [
      "https://vc.example.com/?queryID=6206f1f744a781480c521902a1a1dbf5f1d01e7ea21daf483e7668817e58598a",
      "https://vc.example.com/?queryID=7306f1f744a781480c521902a1a1dbf5f1d01e7ea21daf483e7668817e58598a",
      "https://vc.example.com/?queryID=6206f1f744a781480c521902a1a1dbf5f1d01e7ea21daf483e7668817e58598a"
    ],
    "certificateName": "ACME Ecommerce Order Registration Certificate"
  }
}