{
  "@context": [
    "https://www.w3.org/2018/credentials/v1",
    "https://w3id.org/traceability/v1"
  ],
  "id": "http://example.org/credentials/",
  "type": [
    "VerifiableCredential"
  ],
  "issuanceDate": "2021-02-04T20:29:37+00:00",
  "issuer": "did:example:123",
  "credentialSubject": {
    "@context": [
      "https://w3id.org/traceability/v1"
    ],
    "type": "LEIregistration",
    "initialRegistrationDate": "2020-01-01",
    "lastUpdateDate": "2020-01-01",
    "status": "IN PROGRESS",
    "nextRenewalDate": "2021-02-02",
    "managingLou": "YAYYFCJVDMNRLNXMYVJT",
    "validationSources": "PARTIALLY_CORROBORATED",
    "validationAuthority": [
      {
        "type": "LEIauthority",
        "validationAuthorityID": "RA000003",
        "otherValidationAuthorityID": "Y9IF2QMC",
        "validationAuthorityEntityID": "CBUAFH666HRP91R072BJ"
      }
    ]
  }
}