{
  "@context": [
    "https://www.w3.org/2018/credentials/v1",
    "https://w3id.org/traceability/v1"
  ],
  "id": "http://example.org/credentials/",
  "type": [
    "VerifiableCredential"
  ],
  "issuanceDate": "2021-02-04T20:29:37+00:00",
  "issuer": "did:example:123",
  "credentialSubject": {
    "@context": [
      "https://w3id.org/traceability/v1"
    ],
    "type": "InspectionReport",
    "observation": [
      {
        "type": "Observation",
        "property": {
          "type": "ChemicalProperty",
          "name": "Europium",
          "formula": "Eu",
          "inchi": "InChI=1S/Eu",
          "inchikey": "OGPBJKLSAFTDLK-UHFFFAOYSA-N"
        },
        "measurement": {
          "type": "MeasuredValue",
          "value": "100.00",
          "unitCode": "P1"
        }
      }
    ]
  }
}