{
  "@context": [
    "https://www.w3.org/2018/credentials/v1",
    "https://w3id.org/traceability/v1"
  ],
  "id": "http://example.org/credentials/",
  "type": [
    "VerifiableCredential"
  ],
  "issuanceDate": "2021-02-04T20:29:37+00:00",
  "issuer": "did:key:z6MktHQo3fRRohk44dsbE76CuiTpBmyMWq2VVjvV6aBSeE3U",
  "credentialSubject": {
    "@context": [
      "https://w3id.org/traceability/v1"
    ],
    "type": "CommodityType",
    "commodityDescription": "Flat-rolled products of iron or nonalloy steel, of a width of 600 mm or more, hot-rolled, not clad, plated or coated: Of a thickness of less than 3 mm High-strength steel.",
    "commodityCode": "7208.26.0030",
    "commodityCodeScheme": "HTS"
  }
}