{
  "@context": [
    "https://www.w3.org/2018/credentials/v1",
    "https://w3id.org/traceability/v1"
  ],
  "id": "http://example.org/credentials/",
  "type": [
    "VerifiableCredential"
  ],
  "issuanceDate": "2021-02-04T20:29:37+00:00",
  "issuer": "did:example:123",
  "credentialSubject": {
    "@context": [
      "https://w3id.org/traceability/v1"
    ],
    "type": "Observation",
    "property": {
      "type": "MechanicalProperty",
      "identifier": "ISO 180",
      "name": "Izod Impact Strength Test",
      "description": "ISO 180 defines the method used for pendulums to determine the impact resistance of a plastic specimen when supported in a cantilever configuration. Test results are used to evaluate the resilience of materials, typically plastics."
    },
    "measurement": {
      "type": "MeasuredValue",
      "value": "22.493",
      "unitCode": "B13"
    }
  }
}