
{
"@context": [
   "https://www.w3.org/2018/credentials/v1",
   "https://w3id.org/traceability/v1"
 ],
 "id": "https://example.com/credentials/123",
 "type": ["VerifiableCredential"],
 "issuanceDate": "2021-02-04T20:29:37+00:00",
 "issuer": "did:example:123",
"credentialSubject": {
   "type": "ppq203",
   "facility": {
      "type": "Place",
      "globalLocationNumber": "2835034258350",
      "geo": {
         "type": "GeoCoordinates",
         "latitude": "38.8303",
         "longitude": "135.2572"
      },
      "address": {
         "type": "PostalAddress",
         "organizationName": "Mann LLC",
         "streetAddress": "6074 Kemmer Summit",
         "addressLocality": "North Carrieview",
         "addressRegion": "Indiana",
         "postalCode": "96474-7026",
         "addressCountry": "USA"
      }
   },
   "inspector": {
      "type": "Inspector",
      "person": {
         "type": "Person",
         "firstName": "May",
         "lastName": "Hane",
         "email": "Devante.Hauck@example.net",
         "phoneNumber": "555-734-8303",
         "worksFor": {
            "type": "Organization",
            "name": "Cassin Inc",
            "description": "Providing good inspections",
            "address": {
               "type": "PostalAddress",
               "streetAddress": "20355 Cordia Spurs",
               "addressLocality": "Port Bridgetport",
               "addressRegion": "Hawaii",
               "postalCode": "57015",
               "addressCountry": "USA"
            },
            "email": "Zion34@example.com",
            "phoneNumber": "555-810-8218",
            "faxNumber": "555-536-5446"
         },
         "jobTitle": "Director of Food Inspections"
      },
      "qualification": [
         {
            "type": "Qualification",
            "qualificationCategory": "Central Inspection Officer",
            "qualificationValue": "Facilitator"
         }
      ]
   },
   "shipment": {
      "type": "ParcelDelivery",
      "deliveryAddress": {
         "type": "PostalAddress",
         "organizationName": "Auer, Ernser and Thompson",
         "streetAddress": "282 Noe Village",
         "addressLocality": "West Candelarioton",
         "addressRegion": "Oregon",
         "postalCode": "91758-6895",
         "addressCountry": "USA"
      },
      "originAddress": {
         "type": "PostalAddress",
         "organizationName": "Bosco - Nolan",
         "streetAddress": "87881 Windler Drives",
         "addressLocality": "Port Dejamouth",
         "addressRegion": "Utah",
         "postalCode": "17543",
         "addressCountry": "USA"
      },
      "deliveryMethod": "Truck transport",
      "trackingNumber": "613770897867"
   },
   "applicant": {
      "type": "Person",
      "firstName": "Freddy",
      "lastName": "Bode",
      "email": "Uriel_Kuhic@example.org",
      "phoneNumber": "555-148-7393",
      "worksFor": {
         "type": "Organization",
         "name": "Sanford Inc",
         "description": "Providing food inspections",
         "address": {
            "type": "PostalAddress",
            "streetAddress": "6948 Alfonso Falls",
            "addressLocality": "East Desmondmouth",
            "addressRegion": "Rhode Island",
            "postalCode": "36187",
            "addressCountry": "USA"
         },
         "email": "Levi.Corwin89@example.net",
         "phoneNumber": "555-229-6464",
         "faxNumber": "555-248-7097"
      },
      "jobTitle": "National Optimization Analyst"
   },
   "inspectionDate": "2020-03-15",
   "inspectionType": "Food Safety",
   "observation": [
      {
         "type": "Observation",
         "property": {
            "type": "ChemicalProperty",
            "name": "Americium",
            "formula": "Am",
            "inchi": "InChI=1S/Am",
            "inchikey": "LXQXZNRPTYVCNG-UHFFFAOYSA-N"
         },
         "measurement": {
            "type": "MeasuredValue",
            "value": "40.794",
            "unitCode": "P1"
         }
      },
      {
         "type": "Observation",
         "property": {
            "type": "ChemicalProperty",
            "name": "Dysprosium",
            "formula": "Dy",
            "inchi": "InChI=1S/Dy",
            "inchikey": "KBQHZAAAGSGFKK-UHFFFAOYSA-N"
         },
         "measurement": {
            "type": "MeasuredValue",
            "value": "59.206",
            "unitCode": "P1"
         }
      }
   ],
   "certificateNumber": "283728361115",
   "carrierId": "797385833528",
   "signatureDate": "2021-02-16"
}

}