{
  "@context": [
    "https://www.w3.org/2018/credentials/v1",
    "https://w3id.org/traceability/v1"
  ],
  "id": "https://example.com/credentials/123",
  "type": ["VerifiableCredential"],
  "issuanceDate": "2021-02-04T20:29:37+00:00",
  "issuer": "did:example:123",
   "credentialSubject": {
      "id": "did:example:123",
      "type": "Organization",
      "name": "California Avocados Direct",
      "description": "Fourth generation family avocado farm",
      "address": {
         "type": "PostalAddress",
         "streetAddress": "9700 Circle R Dr,",
         "addressLocality": "Escondido",
         "addressRegion": "California",
         "postalCode": "92026",
         "addressCountry": "USA"
      },
      "email": "Chase97@example.com",
      "phoneNumber": "555-187-9457"
   }
}
